Lastname,Firstname,GridRef,Town,Address,Tel,Email,Web,Walling,Other
Bartlett,Stephen,SY 63994 80791,Weymouth,"532 Chickerell Road, Chickerell, Weymouth, Dorset, DT3 4DL",07921 292002,info@sb-stonewalling-hedgelaying.co.uk,https://sb-stonewalling-hedgelaying.co.uk,Level 1,"Hedgelaying, Coppicing"
Baxter,Jed,TQ 18625 71177,Kingston upon Thames,"137 Latchmere Lane, Kingston upon Thames, Surrey, KT2 5NX",07838 746 485,jedbaxter@gmail.com,https://www.drystonejed.co.uk/contact,Level 2,
Rowland,Geoff,ST 56186 16682,Yeovil,"22 Fielding Road, Yeovil, BA21 4RH",07706 419882,rowland.geoff@gmail.com,,Level 2,"Hedgelaying, Brushcutting"
Seaman,Shaun,SU 25936 27072,Salisbury,"1 Railway Cottages, West Dean, Salisbury, Wiltshire, SP5 1JG",07812 497360,shaman67@clara.co.uk,http://www.dry-stone-works.co.uk,Level 2,
Stallard,Martin,SX 81193 63782,Totnes,"The Lodge, Buckyette, Littlehempston, Totnes, Devon, TQ9 6ND",07773 276125,info@martinstallardstonework.co.uk,http://www.martinstallardstonework.co.uk,Level 3,"Hedgelaying, Cobblestoning, Coppicing, Chestnut Fencing, Fruit Tree Pruning"
Trouton,Tom,ST 64403 32518,Castle Carey,"Freedland, Olympic Drive, Castle Cary, Somerset, BA7 7HW",01963 351850,info@tomtrouton.co.uk,https://www.tomtrouton.co.uk,,"Lime Mortar Construction, Landscaping"
Woodham,Russell,SY 63097 91597,Dorchester,"2 Keepers Cottage, Hampton, Dorchester, Dorset, DT2 9DY",07970 044625,info@dorset-hedgelayer.co.uk,https://www.dorset-hedgelayer.co.uk,Level 1,Hedgelaying. Grass Cutting
